brand_name,item_name,brand_id,item_id,upc,item_type,item_description,nf_ingredient_statement,nf_calories,nf_calories_from_fat,nf_total_fat,nf_saturated_fat,nf_trans_fatty_acid,nf_polyunsaturated_fat,nf_monounsaturated_fat,nf_cholesterol,nf_sodium,nf_total_carbohydrate,nf_dietary_fiber,nf_sugars,nf_protein,nf_vitamin_a_dv,nf_vitamin_c_dv,nf_calcium_dv,nf_iron_dv,nf_potassium,nf_servings_per_container,nf_serving_size_qty,nf_serving_size_unit,nf_serving_weight_grams,metric_qty,metric_uom,images_front_full_url,updated_at,section_ids
Musco Family Olive Co.,Pitted California Ripe Olives,51db37b8176fe9790a898b4d,551f767a54c77bfa51ec9dad,76040000072,2,null,null,25,20,2,0,0,0,1.5,0,95,1,null,null,0,null,null,null,null,null,12,3,olives,14,14,g,https://d1r9wva3zcpswd.cloudfront.net/551f76de37b949795335687c.jpeg,2015-04-04T05:30:06+00:00,null
Gilda,Mini Toasts,51db37ff176fe9790a89ad67,5566937da431eb610e1af4f2,71656002588,2,null,null,68,18,2,1,0,null,null,0,64,11,1,0.5,2,0,0,0,0,null,7,8,toast,16,16,g,https://d1r9wva3zcpswd.cloudfront.net/5566936e7825ed6627085a28.jpeg,2015-05-28T04:02:55+00:00,null
Western Family,Apple Juice from Concentrate with Added Vitamin C,51db37cb176fe9790a8999a4,51c3612c97c3e69de4b02834,15400013277,2,null,"Water, Apple Juice Concentrate, Ascorbic Acid (Vitamin C).",110,0,0,0,null,null,null,0,35,28,null,28,0,0,130,0,0,null,8,8,fl oz,226,226,g,null,2014-11-24T20:24:24+00:00,null
Wolfgang Puck,"Soup, Organic, Signature Tortilla",51db37e4176fe9790a89a555,51d2fc05cc9bff111580e07f,58328761547,2,"Organic, Signature Tortilla","Water, Organic Vegetable Stock (Water, Vegetables (Certified Organic Ingredient), Reconstituted Vegetables (Certified Organic Ingredient), [Carrots (Certified Organic Ingredient), Celery (Certified Organic Ingredient), Onions (Certified Organic Ingredient), Tomatoes (Certified Organic Ingredient)]), Organic Diced Tomatoes in Organic Tomato Juice, Organic Corn, Organic Tomato Puree (Water, Organic Tomato Paste), Organic Onions, Organic Black Beans, Organic White Corn Masa, Organic Red Peppers, Contains Less than 2% of: Organic Extra Virgin Olive Oil, Organic Evaporated Cane Sugar Juice, Salt, Organic Spice, Organic Cane Sugar, Organic Maltodextrin, Organic Soy Sauce (Water, Soybeans (Certified Organic Ingredient), Salt, Alcohol (Certified Organic Ingredient)), Sea Salt, Organic Jalapeno Peppers, Organic Cilantro, Organic Oregano, Flavoring, Organic Dehydrated Onion, Organic Potato Starch, Yeast Extract, Organic Dehydrated Garlic. Gluten free.",140,30,3,1,0,null,null,0,680,21,6,8,5,8,2,6,8,null,2,1,cup,205,205,g,null,2014-11-24T20:24:24+00:00,null
Jenny's Cuisine,Chocolate Cakes,5457c49153af3d475e632af2,55275eb04dc5e9ff44b3382b,655447101829,2,null,null,160,27,3,1,0.1,null,null,10,200,28,5,17,5,0,0,4,4,null,null,51,g,51,51,g,https://d1r9wva3zcpswd.cloudfront.net/55275fbbd75bd6832e5e4e85.jpeg,2015-04-10T05:29:32+00:00,null
Labrada Nutrition,"Lean Body, Strawberries & Cream",51db37b3176fe9790a898735,5519db827e0a3a0f4e6f31eb,117882000056,2,null,null,260,80,9,1,0,null,null,25,550,9,5,0,40,25,25,40,25,null,1,1,drink box,null,500,ml,https://d1r9wva3zcpswd.cloudfront.net/5519dd022e71ab0f58092c1d.jpeg,2015-03-30T23:32:18+00:00,null
Rosenberger's Dairies,"Milk, 2% Reduced Fat, Vitamin D Added",51db37bc176fe9790a898e4f,51c3c0d497c3e6d8d3b49267,79997000645,2,"2% Reduced Fat, Vitamin D Added","Reduced Fat Milk, Vitamin A Palmitate and Vitamin D3 Added.",130,45,5,3,0,null,null,20,125,13,0,12,8,10,2,30,0,null,2,1,cup,226,226,g,null,2014-11-24T20:24:24+00:00,null
Texas Pete,Kickin' Sweet Potato Fries Straight Cut,51db37c2176fe9790a899183,52b7bdacd4a4ee243a00080c,852115004035,2,null,null,140,60,6,1,0,null,null,0,590,19,4,6,2,110,2,2,4,null,7,3,oz,84,84,g,https://d1r9wva3zcpswd.cloudfront.net/536bc04df1f85db0054dd8bd.jpeg,2014-11-24T20:24:24+00:00,null
Chabaso Bakery,Rustic Ciabatta Loaf,51db37c5176fe9790a8993a9,55226d5734a170c23965eb60,606991071021,2,null,null,150,0,0.5,0,0,null,null,0,370,31,1,0,5,0,0,2,10,null,4,2,inch slice,57,57,g,https://d1r9wva3zcpswd.cloudfront.net/55226d618bf6821d508254f2.jpeg,2015-04-06T11:26:26+00:00,null
Island Princess,Lightly Salted Macadamia Nuts,547f1a4ba603b7a9696cdf19,54bcc5dd4f94662447fdf569,24048004622,2,null,null,110,100,11,2,0,null,null,0,30,2,1,1,1,0,0,0,1,null,5,0.5,oz,14,14,g,https://d1r9wva3zcpswd.cloudfront.net/54bcc7d3df49969d2f183825.jpeg,2015-01-19T09:01:07+00:00,null
Embasa,"Carrots, In Escabeche 7 Oz",51db37dd176fe9790a89a0f4,51c541e397c3e6efadd5c2ff,30684939761,2,In Escabeche 7 Oz,"Carrots, Onions, Jalapeno Peppers, Water, Vinegar, Salt, Sugar, Spices and Calcium Chloride.",15,0,0,null,null,null,null,null,490,2,0,1,0,80,4,0,2,null,7,30,G,30,30,g,null,2014-11-24T20:24:24+00:00,null
AMPM,"Candy, Gummi Worms",51db37c8176fe9790a8995b6,51c3ed5497c3e6de73cbb136,83350019434,2,Gummi Worms,"Corn Syrup, Sugar, Gelatin, Citric Acid, White Grape Juice Concentrate, Hydrogenated Coconut Oil (Adds a Trivial Amount of Fat), Natural and Artificial Flavor, Carnauba Wax, Red 40, Yellow 5, Yellow 6, Blue 1, Beeswax.",190,0,0,null,0,null,null,null,0,46,null,40,4,0,0,0,0,null,1,1,package,71,71,g,null,2014-11-24T20:24:24+00:00,null
Archer Farms,Monster Trail Mix,51db37b0176fe9790a8983eb,52cd67b9d0eefe626b000f60,85239807866,2,null,"Peanuts, Chocolate Candies (Milk Chocolate [Sugar, Chocolate, Skim Milk, Cocoa Butter, Lactose, Milkfat, Soy Lecithin, Salt, Artificial Flavors], Sugar, Cornstarch, Less than 1% of the Following: Corn Syrup, Dextrin, Coloring [Includes Blue 1 Lake, Red 40 Lake, Yellow 6, Yellow 5, Red 40, Blue 1, Blue 2 Lake, Yellow 6 Lake, Yellow 5 Lake, Blue 2], Gum Acacia), Raisins Coated with Less than 1% Sunflower and/or Canola Oil, Milk Chocolate Chips (Sugar, Cocoa Butter, Whole Milk Powder, Chocolate Liquor, Soy Lecithin, Vanillin [Artificial Flavoring]), Peanut Butter Chips (Sugar, Partially Hydrogenated Vegetable Oil [Palm Kernel and/or Soybean], Partially Defatted Peanuts, Nonfat Dry Milk Powder, Whey Powder, Reduced Minerals Whey, Peanut Butter [Peanuts, Hydrogenated Rapeseed and Cottonseed Oil], Dextrose, Contains 1% or Less of the Following: Salt, Soy Lecithin and Vanillin [Artificial Flavor]), Vegetable Oil (Peanut, Cottonseed, Soybean and/or Sunflower Seed).",170,90,9,3.5,0,null,null,0,20,20,1,16,4,0,0,4,2,null,11,0.25,cup,36,36,g,https://d1r9wva3zcpswd.cloudfront.net/536b9cc9f1f85db0054dce9a.jpeg,2015-03-09T17:37:52+00:00,null
Fresh Gourmet,Oven Roasted Sliced Almonds,51db37b4176fe9790a898796,5548e6eb27d8878c7109e4d0,78735217,2,null,null,40,35,3.5,null,null,null,null,null,30,1,1,null,2,null,null,2,2,null,14,1,tbsp,7,7,g,https://d1r9wva3zcpswd.cloudfront.net/5548e6546ed6300565d181fe.jpeg,2015-05-05T15:48:36+00:00,null
Godiva Chocolatier,"Dark Chocolates, Assorted",51db37b3176fe9790a8986ea,51c36fbc97c3e69de4b09d4c,31290044412,2,Assorted,"Bittersweet Chocolate (Chocolate Liquor (Processed with Alkali), Sugar, Cocoa Butter, Butteroil, Milk, Soy Lecithin (Emulsifier), Natural Flavor), Heavy Cream, High Fructose Corn Syrup, Invert Sugar, Sugar, Milk, Evaporated Milk (Vitamin D), Partially Hydrogenated Palm Kernel Oil, Brown Sugar, Cocoa Butter, Chocolate Liquor, Breakfast Cocoa, Soy Lecithin (Emulsifier), Salt, Natural Flavor.",200,100,11,7,null,null,null,5,55,22,2,18,2,0,0,0,10,null,3,5,pieces,40,40,g,null,2014-11-24T20:24:24+00:00,null
Baci,"Dark Chocolate, with Whole & Chopped Hazelnuts",51db37c6176fe9790a899467,51c3b81f97c3e6d8d3b44fde,39456001354,2,with Whole & Chopped Hazelnuts,"Sugar, Hazelnuts, Chocolate Processed with Alkali, Cocoa Butter, Milk, Milkfat, Soy Lecithin, Vanillin - an Artificial Flavour.",150,100,11,4,0,null,null,3,0,15,1,12,2,0,0,2,2,null,1,1,package,null,null,null,null,2014-11-24T20:24:24+00:00,null
Ghirardelli Chocolate,Spring Caramel Chocolate Trio,51db37c0176fe9790a89900f,5523f759133842e32049521e,747599322006,2,null,null,220,120,13,8,0,null,null,5,70,28,2,22,2,2,0,4,8,null,5,3,squares,45,45,g,https://d1r9wva3zcpswd.cloudfront.net/5523f8b051c0ecdf2ec64fe1.jpeg,2015-04-07T15:33:04+00:00,null
La Croix,"Sparkling Water, Orange",51db37c5176fe9790a89934b,5518c2d427f56989151dde5c,73360619359,2,null,null,0,null,0,null,null,null,null,null,0,0,null,null,0,null,null,null,null,null,4,8,fl oz,null,240,ml,https://d1r9wva3zcpswd.cloudfront.net/5518df58771e2e761568c8bc.jpeg,2015-03-30T05:30:00+00:00,null
Hy-Vee,"Coffee Creamer, Original",51db37b0176fe9790a8983f0,51c3bc9b97c3e6d8d3b470e2,75450059731,2,Original,"Corn Syrup Solids, Partially Hydrogenated Soybean Oil, Sodium Caseinate (a Milk Derivative), Dipotassium Phosphate, Mono and Diglycerides, Silicon Dioxide, Artificial Color, Sodium Stearoyl Lactylate, Soy Lecithin, Artificial Flavor.",10,5,0,0,null,null,null,0,0,1,0,0,0,0,0,0,0,null,312,1,teaspoon,2,2,g,null,2014-11-24T20:24:24+00:00,null
Giant Eagle Market District,Chocolate Covered Mini Pretzels,5457c0ca53af3d475e6329e8,559ac79f41940ee65000554c,30034078812,2,null,null,150,60,7,4,0,null,null,5,130,19,1,11,2,0,0,4,4,null,2,4,pretzels,29,29,g,https://d1r9wva3zcpswd.cloudfront.net/559ae32e80c4c1c644e97762.jpeg,2015-07-06T20:21:02+00:00,null
Original,"Turkey Breast (854002), Oven Roasted",51db37cf176fe9790a899ce5,51c5408597c3e6efadd5b803,42222854023,2,Oven Roasted,"Turkey Breast Meat, Turkey Broth, Contains 2% Or Less Salt, Modified Food Starch, Sodium Phosphate, Carrageenan, Flavoring.",0,0,null,null,null,null,null,null,null,null,null,null,null,0,0,0,0,null,null,56,G,56,56,g,null,2014-11-24T20:24:24+00:00,null
Sanders,Milk Chocolate Cashew Torties,51db37c9176fe9790a899603,545a50fd8c56fa5416027834,35900252723,2,null,null,180,100,11,5,0,null,null,10,35,20,1,13,3,2,0,4,4,null,2.3,3,pieces,43,43,g,https://d1r9wva3zcpswd.cloudfront.net/545a54c538554b701693aa83.jpeg,2014-11-24T20:24:24+00:00,null
M-Azing,"Ghostly Giggles, Minis, Crunchy",51db37c8176fe9790a8995d7,51c3b9b697c3e6d8d3b45bb9,40000162582,2,"Minis, Crunchy","Milk Chocolate (Sugar, Cocoa Butter, Skim Milk, Chocolate, Milkfat, Lactose, Soy Lecithin, PGPR, Artificial Flavors, Salt), Rice Flour, Sugar, Less than 2% - Cocoa Butter, Barley Malt Extract, Salt, Coloring (Includes Yellow 6 Lake, Yellow 5 Lake, Red 40 Lake, Blue 1 Lake, Turmeric Yellow 5, Yellow 6, Blue 1, Red 40, Blue 2 Lake, Blue 2), Cornstarch, Corn Syrup, Dextrose, Calcium Carbonate, PGPR, Dextrin.",200,90,10,6,0,null,null,5,30,25,1,23,2,0,0,4,0,null,8,6,pieces,37,37,g,null,2014-11-24T20:24:24+00:00,null
Season,"Tuna, Albacore, Solid White in Water",51db37be176fe9790a898f2e,51c3bac097c3e6d8d3b46446,70303024904,2,"Albacore, Solid White in Water","Solid White Albacore Tuna, Water, Salt.",70,10,1,0,0,null,null,25,250,0,0,0,14,0,0,0,2,null,2,0.25,cup,56,56,g,null,2014-11-24T20:24:24+00:00,null
Tolerex,"Maintenance Elemental Diet, Unflavored Powder",51db37c9176fe9790a89965a,51c3c98597c3e6d8d3b4d345,43900458052,2,Unflavored Powder,"Maltodextrin (Corn), Magnesium Gluconate, L-Glutamine, Calcium Glycerophosphate, L-Arginine Acetate, Food Starch Modified (Corn), L-Aspartic Acid, Glycine, L-Lysine Acetate, L-Leucine, Safflower Oil, Potassium Chloride, L-Proline, L-Phenylalanine, L-Valine, L-Alanine, L-Methionine, L-Threonine, L-Isoleucine, Sodium Phosphate Dibasic, L-Serine, Potassium Sorbate, Potassium Citrate, L-Histidine Monohydrochloride Monohydrate, Sodium Citrate, L-Tryptophan, L-Tyrosine, Choline Bitartrate, Polyoxyethylene Sorbitan Monooleate, Ascorbic Acid, Ferrous Sulfate, Alpha Tocopheryl Acetate, Zinc Sulfate, Niacinamide, Copper Gluconate, Calcium Pantothenate, Manganese Sulfate, Ascorbyl Palmitate (to Preserve Freshness), Vitamin A Palmitate, Alpha Tocopherol (to Preserve Freshness), Pyridoxine Hydrochloride, Riboflavin, Thiamine Hydrochloride, Chromic Acetate, Folic Acid, BHA/BHT (to Preserve Freshness), Biotin, Potassium Iodide, Sodium Molybdate, Sodium Selenite, Phytonadione (Vitamin K1), Cholecalciferol (Vitamin D3), Cyanocobalamin (Vitamin B12).",375,0,0,null,null,null,null,null,176,85,null,null,8,21,21,21,21,null,null,100,g,100,100,g,null,2014-11-24T20:24:24+00:00,null
CapriSun,"Flavored Juice Drink, Fruit Punch",51db3816176fe9790a89b365,550782ce02d374b7239057bf,87684006382,2,null,null,130,null,0,null,null,null,null,null,25,34,null,33,0,null,10,null,null,null,null,1,pouch,null,331,ml,https://d1r9wva3zcpswd.cloudfront.net/550783d0f36acf0a524dc636.jpeg,2015-03-17T01:30:56+00:00,null
Gold Emblem,"Mixed Nuts, Deluxe, No Peanuts",51db37b2176fe9790a8984d7,51c3d13997c3e6d8d3b512ea,50428451540,2,"Deluxe, No Peanuts","Cashews, Almonds, Brazil Nuts, Filberts/Hazelnuts, Pecans, Peanut and/or Canola and/or Cottonseed Oil, Sea Salt.",170,140,15,2,0,null,null,0,110,6,2,1,5,0,0,4,8,null,9,0.25,cup,28,28,g,null,2014-11-24T20:24:24+00:00,null
Trucchi's Supermarkets,Fork Split English Muffins,5538f8c1d578002052e739e6,5576f3a90be581303f311ae7,835841009086,2,null,null,130,10,1.5,0.5,0,0,0,0,110,26,1,6,5,0,0,4,8,null,6,1,muffin,57,57,g,https://d1r9wva3zcpswd.cloudfront.net/5576f644a1a3546857b9d853.jpeg,2015-06-09T14:20:52+00:00,null
J & Ds,"Croutons, Bacon",51db37b4176fe9790a8987c2,51c3c4e397c3e6d8d3b4b1e5,17017010021,2,Bacon,"Enriched Wheat Flour (Wheat Flour, Malted Barley Flour, Niacin, Reduced Iron, Thiamin Mononitrate, Riboflavin, and Folic Acid), Water, Canola Oil, Bacon Flavored Seasoning (Salt, Paprika, Garlic, Maltodextrin, Natural Flavor, Autolyzed Yeast Extract and Less than 2% Silicon Dioxide Added to Prevent Caking), Palm Oil Shortening, Dextrose, Sea Salt, and Yeast.",30,12,1,0,0,null,null,0,85,4,0,0,0,1,0,0,1,null,18,6,croutons,7,7,g,null,2014-11-24T20:24:24+00:00,null
Signature Pick 5,Corndogs,51db37b1176fe9790a89846d,51c3c7b597c3e6d8d3b4c696,59987060712,2,null,"Batter: Water, Enriched Wheat Flour and Enriched Corn Meal (Both Enriched with: Niacin, Iron, Thiamine Mononitrate, Riboflavin, Folic Acid), Sugar, Salt, Baking Powder (Sodium Aluminum Phosphate, Sodium Bicarbonate), Whey Solids, Soy Flour, Whole Dried Eggs, Fried in Vegetable Oil. Chicken Frank: Mechanically Separated Chicken, Water, Salt, Contains 2% or Less of the Following: Corn Syrup Solids, Spices, Potassium Lactate, Sodium Phosphate, Sodium Diacetate, Flavorings Sodium Erythorbate, Sodium Nitrite.",270,140,15,null,null,null,null,50,730,22,1,null,10,0,0,8,15,null,6,1,corn dog,125,125,g,null,2014-11-24T20:24:24+00:00,null
Maple Leaf Natural Selections,"Pizza Snacks, Pepperoni & Bacon",553bf00dd2aa910638bbaf13,553bef3c826ced140d5856fe,63100109578,2,null,null,210,72,8,3.5,0.1,null,null,15,420,23,2,4,12,6,2,10,8,null,null,1,pizza snack,85,85,g,https://d1r9wva3zcpswd.cloudfront.net/553bef9bd2d6d6b2797273ea.jpeg,2015-04-25T19:48:43+00:00,null
Trader Joe's,Just Chicken,51db381b176fe9790a89b587,54f4f16b687cb1c252cc1580,30204386,2,null,null,130,25,2.5,1,0,null,null,65,210,1,0,0,24,0,0,2,4,null,5,3,oz,85,85,g,https://d1r9wva3zcpswd.cloudfront.net/54f5b725a79a909a0a3e6f77.jpeg,2015-03-03T13:29:10+00:00,null
Morton & Bassett Spices,Pure Vanilla Extract,5564ed4e0620b94f48f419bd,55858fa8f1572eb8087562b4,16291445802,2,null,null,12,null,0,null,null,null,null,null,0,0,null,null,0,null,null,null,null,null,23,1,tsp,null,5,ml,https://d1r9wva3zcpswd.cloudfront.net/558591b0c24f6c897deb3b75.jpeg,2015-06-20T16:15:45+00:00,null
Ultimate Nutrition,"Massive Whey Gainer, Delicious Strawberry Flavor",51db37ca176fe9790a899789,51c3d03997c3e6d8d3b50a52,99071002020,2,Delicious Strawberry Flavor,"Premium Ultra and Microfiltrated Whey Protein (High Protein Concentrate and Isolate), Glucose Polymers (Maltodextrin), Crystalline Fructose, Natural Strawberry Flavor, Natural and Artificial Vanilla Flavor, Beet Powder (Color), Ascorbic Acid, Vitamin A Palmitate, Niacinamide, Calcium Pantothenate, Vitamin D3, Riboflavin, Vitamin E Acetate, Thiamin Mononitrate, Pyridoxine HCL, Vitamin B12, Folic Acid, and Biotin. Essential Amino Acids: L-Leucine (7020 mg), L-Isoleucine (3390 mg), L-Valine (2626 mg), L-Lysine (5826 mg), L-Threonine (2294 mg), L-Methionine (1127 mg), L-Phenylalanine (2116 mg), L-Tryptophan (1401 mg). Non-Essential Amino Acids: L-Arginine (1003 mg), L-Aspartic Acid (5641 mg), L-Cystine/Cystein (2024 mg), L-Alanine (2778 mg), L-Glutamic Acid (9276 mg), L-Glycine (1038 mg), L-Histidine (1127 mg), L-Proline (2273 mg), L-Serine (2149 mg), L-Tyrosine (1889 mg).",628,36,4,2,null,null,null,57,105,93,0,42,55,0,0,23,0,null,12,4,scoops,167,167,g,null,2014-11-24T20:24:24+00:00,null
Wonka,"Candy Bar, Triple Dazzle Caramel",51db37be176fe9790a898ee1,51c3ed1597c3e6de73cbaf69,79200034757,2,Triple Dazzle Caramel,"Sugar, Cocoa Butter, Corn Syrup, Chocolate, Nonfat Milk, Sweetened Condensed Milk, Butter, Milkfat, Lactose, Less than 2% of Hydrogenated Coconut Oil, Fructose, Natural and Artificial Flavors, Salt, Mono and Diglycerides, Soy Lecithin, TBHQ and Citric Acid (to Preserve Freshness).",200,100,12,7,0,null,null,10,75,22,1,18,1,2,0,4,0,null,2.5,4,pieces,40,40,g,null,2014-11-24T20:24:24+00:00,null
Honey Drop,Raw Local Honey,54982f6b4112493933526359,54982f43dffb5d754bfcc6f0,894340002219,2,null,null,90,0,0,0,0,null,null,0,0,23,3,24,3,0,8,6,0,null,null,1,bottle,null,296,ml,https://d1r9wva3zcpswd.cloudfront.net/5498394a83faf9150d6a2933.jpeg,2014-12-22T15:31:22+00:00,null
Twizzlers,"Candy, Pull-N-Peel, Cherry, King Size",51db37d3176fe9790a899efd,51c3712b97c3e69de4b0ab57,34000531073,2,"Pull-N-Peel, Cherry, King Size","Corn Syrup, Enriched Wheat Flour (Flour, Niacin, Ferrous Sulfate, Thiamine Mononitrate, Riboflavin, and Folic Acid), Sugar, Contains 2% or Less of: Palm Oil, Glyceryl Monostearate, Salt, Cornstarch, Glycerin, Natural and Artificial Flavor, Citric Acid, Potassium Sorbate (Preservative), Artificial Color (Red 40), Sulfur Dioxide, to Maintain Freshness.",140,5,1,0,0,null,null,0,85,31,0,17,0,0,0,0,2,null,45,2,pieces,40,40,g,null,2014-11-24T20:24:24+00:00,null
Weber,"Sweet N' Tangy BBQ 6.75 Oz, Seasoning",51db37b2176fe9790a89854c,51c549a497c3e6efadd5ffc2,30684894718,2,Seasoning,"Salt, Brown Sugar, Sugar, Dehydrated Tomato, Garlic Powder, Chili Pepper and Other Spices, Onion Powder, Molasses, Maltodextrin, Calcium Stearate and Calcium Slicate (Anti-Caking Agents), Soy Sauce (Wheat, Soybeans, Salt) Soy Flour, Wheat Starch, Red Pepper, Extractives of Paprika (Color), Natural Smoke Flavor, Disodium Inosinate and Guanylate, White Distilled Vinegar and Lecithin. Contains Soy and Wheat.",5,0,null,null,null,null,null,null,95,1,null,null,0,0,0,0,0,null,192,1,G,1,1,g,null,2014-11-24T20:24:24+00:00,null
Fischer & Wieser,"Preserves, Raspberry Apricot Pecan",51db37e2176fe9790a89a461,51c3644797c3e69de4b04275,20138133258,2,Raspberry Apricot Pecan,"Fruit (Apricots, Raspberries), Sugar, Pecans, Pectin.",50,0,0,0,null,null,null,0,0,13,0,13,0,0,2,0,0,null,15,1,tbsp,21,21,g,null,2014-11-24T20:24:24+00:00,null
Aah Bisto,"Gravy Mix, The Original",51db37b5176fe9790a898866,51c3c5a097c3e6d8d3b4b82d,56781000753,2,The Original,"Potato Starch, Salt, Wheat Starch, Caramel Color, Dried Yeast, Onion Powder.",10,0,0,null,null,null,null,null,420,3,null,0,0,0,0,0,0,null,50,1.5,tsp,5,5,g,null,2014-11-24T20:24:24+00:00,null
Virginia Peanut Company,"Peanuts, Brittle 8 Oz",51db37c9176fe9790a8996a6,51c549d897c3e6efadd6014e,30684840470,2,Brittle 8 Oz,"Peanuts, Syrup, Sugar, Baking Soda. May Contain Nut Traces.",130,40,4,1,0,null,null,0,10,18,1,10,4,0,0,0,0,null,12,28,G,28,28,g,null,2014-11-24T20:24:24+00:00,null
Gerber,"Garden Mashers, Cheddar Potatoes & Broccoli",51db37b6176fe9790a89896d,51c357d197c3e69de4aff016,1570000094,2,Cheddar Potatoes & Broccoli,"Potatoes (Water, Dried Potatoes), Water, Broccoli, Dried Cheddar Cheese, (Pasteurized Milk, Cheese Culture, Salt, Enzymes), Potato Starch, Butter, Pear Juice Concentrate, Salt, Onion/Powder, Whey (From Milk), Dried Cheese (Cultured Pasteurized Milk, Salt, Enzymes, Dried Yeast, Autolyzed Yeast Extract, Natural Flavor, Buttermilk Powder, Annatto Color and Soy Lecithin.",80,20,null,null,0,null,null,null,null,null,null,1,3,6,0,6,2,null,1,1,container,null,null,null,null,2014-11-24T20:24:24+00:00,null
Jennie-O Turkey Store,"Turkey Meatballs (821506), Italian Style Lean",51db37b3176fe9790a898644,51c542aa97c3e6efadd5c906,42222821568,2,Italian Style Lean,"Turkey, Water, Seasoning (Dehydrated Onion, Dried Cane Syrup, Salt, Spices, Dehydrated Garlic, Dehydrated Parsley, Spice Extract), Rice Bran, Soy Protein Concentrate (With Caramel Color), Natural Flavoring.",160,80,8,2,0,null,null,75,620,3,0,1,18,0,2,4,8,null,4,84,G,84,84,g,null,2014-11-24T20:24:24+00:00,null
Rancher's Reserve,"Beef Steaks, Loin, Top Sirloin",51db37b8176fe9790a898aee,51d37db4cc9bff5553aaa60e,201346000000,2,"Loin, Top Sirloin",100% US beef.,270,180,20,8,null,null,null,75,65,0,null,null,21,0,0,0,10,null,null,4,oz,112,112,g,null,2014-11-24T20:24:24+00:00,null
Orion,Choco Pie,51db382e176fe9790a89b8db,55678fba759f78be7bd7d861,716680935616,2,null,null,130,45,5,3.5,0,null,null,0,75,20,0.5,12,1,0,0,2,4,null,48,30,g,30,30,g,https://d1r9wva3zcpswd.cloudfront.net/556790a3759f78be7bd7d897.jpeg,2015-05-28T22:03:15+00:00,null
Bonga,"Baobab Superfood Chews, Raspberry",54072c9c7f1cfd9d3a07a881,54072c9f7f1cfd9d3a07a883,854061005074,2,null,null,90,0,1,0,0,null,null,0,0,30,7,14,2,1,60,2,0,40,null,1,packet,40,40,g,https://d1r9wva3zcpswd.cloudfront.net/54073998a67cfab13a61ab11.jpeg,2014-11-24T20:24:24+00:00,null
Rowe Farms,"Chicken Wings, Sweet Paprika",551fae666e3c45d33db7f73a,55310aa763c037a064fb5967,770346063020,2,null,null,290,162,18,5,0,null,null,75,610,7,1,6,25,2,0,2,8,null,null,4,pieces,100,100,g,https://d1r9wva3zcpswd.cloudfront.net/55310bf0d00705285809b2c9.jpeg,2015-04-17T13:34:41+00:00,null
Chobani Greek Yogurt,Salted Caramel Crunch,555f51fa68cd008d7af1e5a6,55843f726516c17a2bfbc3d2,2417000055,2,null,null,190,45,5,2.5,0,null,null,15,170,25,0.5,17,12,0,0,15,4,null,null,1,container,150,150,g,https://d1r9wva3zcpswd.cloudfront.net/55843fbf6516c17a2bfbc3df.jpeg,2015-06-19T16:13:51+00:00,null
Jfc International Inc.,Seasoned Plum,51db37cf176fe9790a899c8e,55196b846bf10321588142e0,11152139869,2,null,null,20,0,0,0,0,null,null,0,1290,5,1,4,0,0,0,0,0,null,3.5,1,oz,28,28,g,https://d1r9wva3zcpswd.cloudfront.net/55196c442e71ab0f580927f3.jpeg,2015-03-30T15:31:16+00:00,null
Philadelphia,"Whipped Cream Cheese, Chive",51db37bc176fe9790a898e3a,553c5fca9e6799856f9579b2,68100896503,2,null,null,35,27,3,2,0.1,null,null,10,75,1,0,1,1,4,0,2,0,null,null,12,gram,12,12,g,https://d1r9wva3zcpswd.cloudfront.net/553c610aa106f6d21deaac8e.jpeg,2015-04-26T03:52:42+00:00,null
Aleia's,"Gluten Free, Chocolate Chunk Cookies",51db37b9176fe9790a898b86,54fe645f74a6d29e2f18ff57,855930001586,2,null,null,80,35,4,2.5,0,0,1,10,45,12,1,6,1,0,0,0,4,null,14,1,cookie,18,18,g,https://d1r9wva3zcpswd.cloudfront.net/54fe817128e6258d2fcf900f.jpeg,2015-03-10T05:30:25+00:00,null
Dannon,"Yogurt, Nonfat,  Strawberry Flavor, with Rainbow Sprinkles",51db37c5176fe9790a89933c,51d2fd8ccc9bff111580ead3,36632009760,2,"Nonfat,  Strawberry Flavor, with Rainbow Sprinkles","Strawberry Flavored Nonfat Yogurt (Cultured Grade A Non Fat Milk, Sugar, Water, Modified Food Starch, Contains Less than 1% of Modified Corn Starch, Kosher Gelatin, Natural Flavors, Agar Agar, Beta Carotene and Black Carrot Juice Concentrate (for Color), Malic Acid, Potassium Sorbate (to Maintain Freshness), Sodium Citrate, Vitamin D3). Naturally and Artificially Flavored Sprinkles Topping (Sugar, Corn Starch, Palm Oil, Palm Kernel Oil, Dextrin, Confectioner's Glaze (Shellac) Contains Less than 1% of Soy Lecithin, Carnauba Wax, Red 3, Red 40, Blue 1 Lake, Yellow 5 Lake, Yellow 6 Lake, Red 40 Lake).",110,20,2,2,0,null,null,3,50,20,0,14,3,0,0,10,0,null,4,1,container,100,100,g,null,2014-11-24T20:24:24+00:00,null
Immaculate Baking Co.,Vanilla Sugar Cookies,51db37b9176fe9790a898c49,559a8e5795f6dfe42fd64407,665596099038,2,null,null,70,30,3.5,1.5,0,0,1.5,10,30,10,0,5,0.5,null,null,null,null,null,24,1,cookie,17,17,g,https://d1r9wva3zcpswd.cloudfront.net/559a8e6f0d5df1010b06a650.jpeg,2015-07-06T14:19:27+00:00,null
Unknown,French Bread,526831133203b9c3390001c8,55bb1771b7b4ce5e0f73bc26,41172000368,2,null,null,130,10,1.5,0.5,0,null,null,0,250,26,1,2,3,0,0,0,10,null,8,2,oz,58,58,g,https://d1r9wva3zcpswd.cloudfront.net/55bb196527d1bbae4747748c.jpeg,2015-07-31T06:44:53+00:00,null
My Essentials,Butter Pancake Syrup,51db37c5176fe9790a899358,52b65898ab70f55d2e0006fb,725439107136,2,null,null,210,0,0,null,null,null,null,null,140,53,0,29,0,null,null,null,null,null,12,0.25,cup,null,60,ml,https://d1r9wva3zcpswd.cloudfront.net/536bb5d0f1f85db0054dd55e.jpeg,2014-11-24T20:24:24+00:00,null
It's Delish,Pine Nuts,51db37c3176fe9790a899268,51c3d0ac97c3e6d8d3b50e25,99137205525,2,null,Pine Nuts.,213,189,21,2,0,null,null,0,0,4,2,1,3,0,0,0,0,null,2.8,0.25,cup,23,23,g,null,2014-11-24T20:24:24+00:00,null
Snapple,"Lemonade Iced Tea, Half & Half, Diet",51db37b3176fe9790a898712,51d2fb23cc9bff111580da5e,76183000199,2,"Half & Half, Diet","Our Real Tea Starts with the Finest Tea Leaves and is Made From: Filtered Water, Clarified Lemon Juice Concentrate, Citric Acid, Natural Flavors, Tea, Potassium Citrate, Sucralose, Acesulfame Potassium.",10,0,0,null,null,null,null,null,15,1,null,null,0,null,null,null,null,null,6,1,bottle,null,null,g,https://d1r9wva3zcpswd.cloudfront.net/536b8f92480d28113fe8d2f1.jpeg,2014-11-24T20:24:24+00:00,null
Pacific Gold,Pistachios,51db37cb176fe9790a8998aa,51c3643597c3e69de4b041de,20022010634,2,null,"Pistachios, Salt.",180,130,16,2,0,null,null,0,230,8,3,2,4,2,4,4,6,null,5,0.25,cup,28,28,g,null,2014-11-24T20:24:24+00:00,null
Comstock,"Pie Filling & Topping, Premium Dark Sweet Cherry",51db37b1176fe9790a898476,51c53ecc97c3e6efadd5aa90,41255431867,2,Premium Dark Sweet Cherry,"Dark Sweet Cherries, Water, Liquid Sugar (Natural Sugar, Water), Food Starch-Modified, Natural And Artificial Flavor, Artificial Color (Red 40), Erythorbic Acid (to Promote Color Retention).",70,0,0,0,0,null,null,0,25,18,0,14,0,0,0,0,0,null,7,89,G,89,89,g,null,2014-11-24T20:24:24+00:00,null
