brand_name,item_name,brand_id,item_id,upc,item_type,item_description,nf_ingredient_statement,nf_calories,nf_calories_from_fat,nf_total_fat,nf_saturated_fat,nf_trans_fatty_acid,nf_polyunsaturated_fat,nf_monounsaturated_fat,nf_cholesterol,nf_sodium,nf_total_carbohydrate,nf_dietary_fiber,nf_sugars,nf_protein,nf_vitamin_a_dv,nf_vitamin_c_dv,nf_calcium_dv,nf_iron_dv,nf_potassium,nf_servings_per_container,nf_serving_size_qty,nf_serving_size_unit,nf_serving_weight_grams,metric_qty,metric_uom,images_front_full_url,updated_at,section_ids
Kroger,"CARBmaster Cultured Dairy Blend, Cherry",51db37b9176fe9790a898bdd,551e08bad7f7829513dd5ad8,59547778,2,null,null,60,10,1.5,1,0,null,null,5,95,4,0,3,9,8,0,30,2,null,null,1,container,null,null,g,https://d1r9wva3zcpswd.cloudfront.net/551e08d74bb37dd63673ad43.jpeg,2015-04-03T03:28:23+00:00,null
Kroger,"Cashews, Unsalted",51db37b9176fe9790a898bdd,51c35a5197c3e69de4affcfb,11110735744,2,Unsalted,"Cashews, Peanut and/or Cottonseed Oils.",160,120,14,2,0,null,null,0,0,8,1,1,5,0,0,2,10,null,10,0.25,cup,28,28,g,null,2014-11-24T20:24:24+00:00,null
Market Basket,Diet Orange Soda,51db37b1176fe9790a8984d0,551b2d2092163c543948f1ba,49705513934,2,null,null,0,null,0,null,null,null,null,null,0,0,null,0,0,null,null,null,null,null,8,8,fl oz,null,240,ml,https://d1r9wva3zcpswd.cloudfront.net/551b2db392163c543948f1da.jpeg,2015-03-31T23:28:51+00:00,null
Festin,"Pasta Sauce, Premium, Authentic Italian Plum Tomato Marinara Sauce",51db37e0176fe9790a89a2f1,51c4045597c3e6dfa4df543d,30315021308,2,"Premium, Authentic Italian Plum Tomato Marinara Sauce","Tomato Puree (Water, Tomato Paste), Italian Plum Tomatoes, Water, Expeller Pressed Canola Oil, Organic Roasted Onions, Carrots (Carrots, Water, Salt, Calcium Chloride), Sea Salt, Dried Onion, Spices, Dried Garlic, Extra Virgin Olive Oil, Garlic Powder. Gluten free.",70,30,3,0,0,null,null,0,730,9,3,5,1,20,10,0,2,null,5,0.5,cup,136,136,g,null,2014-11-24T20:24:24+00:00,null
Hannaford,"Cereal, Sweetened Oat with Marshmallows",51db37b1176fe9790a898440,51c37c3697c3e6d272825108,41268108237,2,Sweetened Oat with Marshmallows,"Whole Grain Oat Flour (Includes the Oat Bran), Marshmallows (Sugar, Corn Syrup, Dextrose, Modified Food Starch, Gelatin, Artificial and Natural Flavor, Yellow 5 & 6, Red 40, Blue 1), Sugar, Wheat Starch, Corn Syrup, Salt, Calcium Carbonate, Color Added, Dicalcium Phosphate, Trisodium Phosphate, Artificial Flavor, Vitamin C (Sodium Ascorbate), Zinc and Iron (Mineral Nutrients), A B Vitamin (Niacinamide), BHT (a preservative), Vitamin B6 (Pyridoxine Hydrochloride), Vitamin B2 (Riboflavin), Vitamin, Vitamin B1 (Thiamin Mononitrate), Vitamin A Palmitate,  A B Vitamin(Folic Acid), Vitamin B12, Vitamin D.",120,10,1,0,null,null,null,0,160,27,1,13,2,10,10,10,25,null,13,0.75,cup,30,30,g,null,2014-11-24T20:24:24+00:00,null
Metabolic Research Center,Mixed Berry Drink,546b62c9ade15fe62e67f286,54b2fcc778a1787b572f301e,804217362230,2,null,null,70,0,0,0,0,null,null,0,15,4,2,2,15,0,0,2,0,15,7,1,packet,null,34,ml,https://d1r9wva3zcpswd.cloudfront.net/54b302859b94708d3676fa09.jpeg,2015-01-11T23:08:54+00:00,null
Bison,"Cottage Cheese, with Pineapple, Small Curd",51db37b5176fe9790a8988d2,51c3bfba97c3e6d8d3b48981,72510012163,2,"with Pineapple, Small Curd","Cultured Pasteurized Grade A Nonfat Milk, Cream, Pineapple, Sugar, High Fructose Corn Syrup, Whey, Salt, Modified Food Starch, Maltodextrin, Natural Flavors, Pineapple Juice, Citric Acid, Phosphoric Acid, Guar Gum, Carrageenan, Carob Bean Gum, Potassium Sorbate (to Preserve Freshness), Enzyme.",140,35,4,2,null,null,null,20,340,18,0,15,9,4,2,10,0,null,4,0.5,cup,113,113,g,null,2014-11-24T20:24:24+00:00,null
International Delight,"Iced Coffee Beverage, Vanilla",51db37bc176fe9790a898deb,545ce512d43cefdf6dbf7fca,41271021035,2,null,null,160,22.5,2.5,1.5,0,null,null,10,105,30,0,23,4,2,0,15,0,null,null,1,cup,null,250,ml,https://d1r9wva3zcpswd.cloudfront.net/545ce98e4ce901f7437d9f80.jpeg,2014-11-24T20:24:24+00:00,null
Wild Oats,Jalapeno Stuffed Olives,51db37b0176fe9790a8983c2,51c4011f97c3e6dfa4df3bb5,80991102082,2,null,"California Olives Stuffed With Jalapenos, Water, Salt, Lactic Acid and Vinegar.",15,15,1,0,0,null,null,0,410,0,null,null,0,0,0,0,0,null,20,0.5,oz,14,14,g,null,2014-11-24T20:24:24+00:00,null
Pita Gourmet,Balady,54b56ec004e843bd19521560,54b56ec1565b558019158a54,69066000294,2,null,null,160,9,1,0.1,0,null,null,0,270,32,4,0,6,0,0,2,20,null,0,1,roll,57,57,g,https://d1r9wva3zcpswd.cloudfront.net/54b5705908485b0e4e464d5e.jpeg,2015-01-13T19:22:01+00:00,null
Land O Lakes,"Hot Cocoa Mix, Cappuccino Classics Suprema 1.16 Oz",51db37b7176fe9790a8989cb,51c5464a97c3e6efadd5e5a2,30684800702,2,Cappuccino Classics Suprema 1.16 Oz,"Sugar, Non Dairy Creamer [Corn Syrup Solids, Partially Hydrogenated Coconut and Soybean Oil, Sodium Caseinate (A Milk Derivative), Potassium Phosphate, Mono and Diglycerides, Sugar, Sodium Stearoyl Lactylate, Soy Lecithin, Color (Annatto, Turmeric),  Artificial Flavor], Nonfat Dry Milk, Instant Coffee, Cocoa (Processed With Alkali), Cellulose Gum, Salt, Artificial Flavor. Contains Milk, Soy.",140,30,3,3,null,null,null,0,120,25,0,20,3,0,0,8,0,null,1,33,G,33,33,g,null,2014-11-24T20:24:24+00:00,null
Celestial Seasonings,"Herbal Tea, Caffeine Free, Chamomile",51db37c4176fe9790a8992ed,51c4050297c3e6dfa4df5880,70734005251,2,"Caffeine Free, Chamomile",Chamomile. Gluten free.,0,0,0,null,null,null,null,null,0,0,null,0,0,0,0,0,0,null,25,1,tea bag,1,1,g,null,2014-11-24T20:24:24+00:00,null
Namaste Foods,"Frosting Mix, Toffee Vanilla 16.5 Oz",51db37c3176fe9790a899289,51c5417697c3e6efadd5bf98,30684893711,2,Toffee Vanilla 16.5 Oz,"Brown Sugar, Rice Milk Powder, Silicon Dioxide (Added to Prevent Caking), Salt and Pure Ground Vanilla Bean.",150,40,4,2,0,null,null,10,65,29,0,27,0,2,0,2,0,null,16,37,G,37,37,g,null,2014-11-24T20:24:24+00:00,null
Healthy Choice,Crustless Chicken Pot Pie,51db37b3176fe9790a89863a,55d2d344456a0aa119b815e2,72655001466,2,null,null,280,70,8,2,0,2,3,65,600,34,7,3,19,25,4,4,8,null,null,1,meal,272,272,g,https://d1r9wva3zcpswd.cloudfront.net/55d2d467456a0aa119b81625.jpeg,2015-08-18T06:44:55+00:00,null
Yummy Earth,"Gummy Bears, Organic",51db37be176fe9790a898ee4,51c3ede297c3e6de73cbb4ee,10165014101,2,Organic,"Organic Rice Syrup, Organic Cane Sugar, Gelatin, Organic Aronia Juice, Organic Black Currant Juice, Natural Flavor, Citric Acid, Ascorbic Acid, Carnauba Wax, Organic Sunflower Oil. Gluten free.",96,0,0,0,0,null,null,0,0,21,0,12,0,0,0,0,0,null,5,11,bears,28,28,g,null,2014-11-24T20:24:24+00:00,null
Key Food,Pure Honey,51db382d176fe9790a89b8c3,54b2fbf79b94708d3676f7fd,73296114836,2,null,null,60,null,0,null,null,null,null,null,0,17,null,16,0,null,null,null,null,null,16,1,tbsp,21,21,g,https://d1r9wva3zcpswd.cloudfront.net/54b30086baec062b59909a52.jpeg,2015-01-11T23:00:22+00:00,null
Hunter Farms,"Milk, 2% Reduced Fat",51db37bc176fe9790a898ded,54f01bf33e1cba632126a72e,74336863950,2,null,null,230,80,9,5,0,null,null,35,200,19,0,19,16,17,0,50,0,null,1,1.74,cups,null,414,ml,https://d1r9wva3zcpswd.cloudfront.net/54f01c52adc5a97a212c2b75.jpeg,2015-02-27T07:27:14+00:00,null
Roundy's,"Cashews, Halves & Pieces, Salted",51db37b8176fe9790a898af0,54fdf3feb48bcb64594a8473,11150189941,2,null,null,160,120,13,2.5,0,2.5,7,0,110,8,0.5,1,5,0,0,2,10,null,24,0.25,cup,28,28,g,https://d1r9wva3zcpswd.cloudfront.net/54fdf4434e9d7e6f76e3f3e2.jpeg,2015-03-09T19:28:25+00:00,null
Frazier Family Foods,"Hot Sauce, Pineapple Habanero",551eb1057af2ac495b48a3c1,551eb1057af2ac495b48a3c2,760488399965,2,null,null,0,null,0,null,null,null,null,null,60,0,null,null,0,null,null,null,null,null,72,1,tsp,4.5,4.5,g,https://d1r9wva3zcpswd.cloudfront.net/551eb1a2481c7eb05f58ac4e.jpeg,2015-04-03T15:28:34+00:00,null
New England Country Soup,"Soup, Caribbean Black Bean",51db37e0176fe9790a89a2df,51c4041a97c3e6dfa4df524c,72010825119,2,Caribbean Black Bean,"Water, Black Beans, Green Peppers, Red Peppers, Onions, Rice Starch, Chili Peppers, Jalapeno Peppers, Olive Oil, Lower Sodium Sea Salt, Sugar, Cumin, Allspice, Nutmeg.",210,20,2,0,0,null,null,0,230,38,8,4,10,20,50,8,15,null,2,1,cup,212,212,g,null,2014-11-24T20:24:24+00:00,null
Scarpetta Grocery,"Puttanesca Fresh Pasta Sauce, Gluten Free",52ceb1eabba524e06800055e,54072a30a67cfab13a61a524,688672109032,2,null,null,50,25,3,0.5,0,null,null,0,320,6,2,3,2,15,30,4,6,null,5,4,oz,110,110,g,https://d1r9wva3zcpswd.cloudfront.net/5407352f6dab6ba257b12c16.jpeg,2014-11-24T20:24:24+00:00,null
Betty Crocker,"Warm Delights, Molten Chocolate Cake",51db37b0176fe9790a8983c7,51c361fe97c3e69de4b02dd8,16000296527,2,Molten Chocolate,"Cake Mix: Sugar, Enriched Flour Bleached (Wheat Flour, Niacin, Iron, Thiamin Mononitrate, Riboflavin, Folic Acid), Partially Hydrogenated Soybean and/or Cottonseed Oil, Cocoa Processed with Alkali, Corn Starch, Distilled Monoglycerides, Modified Corn Starch, Dried Egg Whites, Whey Protein Isolate, Cellulose Powder, Baking Soda, Salt, Monocalcium Phosphate, Corn Syrup Solids, Nonfat Milk, Soy Lecithin, Xanthan Gum, Artificial Flavor, Freshness Preserved by BHT, Citric Acid, Tocopherol, Ascorbic Acid, Fudge Sauce: Water, Sweetened Condensed Skim Milk (Skim Milk, Sugar, Corn Syrup), Sugar, Fructose, Partially Hydrogenated Palm Kernel Oil, Cocoa, Corn Starch, Buttermilk, Cocoa Processed with Alkali, Butter, Whey, Salt, Sodium Alginate, Natural and Artificial Flavor, Potassium Sorbate (Preservative), Artificial Color, Mono and Diglycerides, Xanthan Gum, Sodium Bicarbonate.",370,110,12,6,1.5,null,null,0,480,61,3,41,5,null,null,10,15,null,1,1,bowl,95,95,g,https://d1r9wva3zcpswd.cloudfront.net/536a7db2a0ec3c690b543840.jpeg,2014-11-24T20:24:24+00:00,null
Bachman,"Pub Nuts, Sweetened and Salted Peanuts",51db37c2176fe9790a8991b2,51c3fefd97c3e6dfa4df2b83,77817212100,2,Sweetened and Salted Peanuts,"Peanuts, Sugar, Corn Syrup, Peanut Oil, Salt.",190,140,15,2,null,null,null,0,160,10,2,4,7,0,0,2,2,null,8,0.25,cup,32,32,g,null,2014-11-24T20:24:24+00:00,null
Magnum,"Ice Cream Bar, Double Caramel",51db3810176fe9790a89b215,551e40f95625602056ca0d5a,7753282,2,null,null,340,190,21,15,0,null,null,20,90,37,1,31,3,4,0,10,10,null,1,98,g,98,98,g,https://d1r9wva3zcpswd.cloudfront.net/551e40a1afbd58f827666ded.jpeg,2015-04-03T07:26:25+00:00,null
Strathmore,"Carbonated Natural Mineral Water, Lime",51db37ef176fe9790a89a908,51c3613e97c3e69de4b028c5,15516012669,2,Lime,"Water, Carbon Dioxide, Natural Lime Flavor.",0,0,0,null,null,null,null,null,15,0,null,null,0,0,0,4,0,null,6,8,fl oz,239,239,g,null,2014-11-24T20:24:24+00:00,null
Wegmans,"Ravioli, Three Cheese",51db37b0176fe9790a8983be,51c3c3ee97c3e6d8d3b4aad1,77890878422,2,Three Cheese,"Pasta: Enriched Durum Semolina (Enriched with Niacin, Ferrous Sulfate, Thiamine Mononitrate, Riboflavin, Folic Acid), Enriched Wheat Flour (Enriched with Niacin, Iron, Thiamine Mononitrate, Riboflavin, Folic Acid), Enriched Wheat Flour (Enriched with Niacin, Iron, Thiamine Mononitrate, Riboflavin, Folic Acid), Fresh Whole Pasteurized Eggs, Water. Filling: Cheese (Ricotta, Parmesan & Romano Cheese Blend [Pasteurized Cow's Milk, Cheese Cultures, Bacterial Culture, Rennet, Calcium Chloride, Microbial Enzyme, Lipase, Cellulose]), Toasted Wheat Crumbs (Wheat Flour, Salt, Hydrogenated Soybean Oil, Spices), Cream (with Dextrose, Sodium Citrate, Sodium Phosphate, Carrageenan, Locust and Carob Bean Gum), Fresh Whole Pasteurized Eggs, Salt, Enriched Wheat Flour (Enriched with Niacin, Iron, Thiamine Mononitrate, Riboflavin, Folic Acid), Canola Oil, Spices, Seasoning (Glucose Solids, Hydrolyzed Plant Protein [Corn, Soy], Hydrogenated Soybean Oil, Onion Powder, Garlic Powder, Ground Turmeric, Disodium Inosinate and Guanylate [Soy]).",270,45,5,2,0,null,null,40,380,45,2,1,11,4,0,4,20,null,5.5,0.75,cup,100,100,g,null,2014-11-24T20:24:24+00:00,null
Unknown,Skim Milk,526831133203b9c3390001c8,545a523ea1e8ac9e23de35f3,83217205185,2,null,null,80,2,0.2,0.1,null,null,null,7,110,11,0,11,8,12,5,30,0,null,null,1,cup,null,240,ml,https://d1r9wva3zcpswd.cloudfront.net/545a578b38554b701693ab7f.jpeg,2014-11-24T20:24:24+00:00,null
Martinelli's Gold MedalR,"100% Juice, Sparkling Apple-Pear",51db37c9176fe9790a8996d2,51c549bd97c3e6efadd6006f,41244902507,2,Sparkling Apple-Pear,"Pure Carbonated Filtered Water (Sufficient to Reconstitute Juice Concentrate), 100% Pure Apple Juice from Us Grown Fresh Apples, Pure Concentrated Pear Juice, Natural Flavors.",130,0,0,0,0,null,null,0,15,31,0,25,1,0,0,2,2,null,1,250,ml,null,null,null,null,2014-11-24T20:24:24+00:00,null
Gwaltney,Naturally Hickory Smoked Thick Cut Sliced Bacon,51db37b2176fe9790a89859a,52b658a12dedad540e00536d,785331721021,2,null,"Cured with: Water, Salt, Sugar, Sodium Phosphate, Sodium Erythorbate, Sodium Nitrite.",80,60,7,2.5,0,null,null,20,390,0,0,0,6,0,0,0,2,null,9,1,fried slice,18,18,g,https://d1r9wva3zcpswd.cloudfront.net/536bbb9bf1f85db0054dd73d.jpeg,2014-11-24T20:24:24+00:00,null
Rockstar,"Energy Gum, Sugar Free, Iced Orange",51db37c9176fe9790a899674,51c3c97297c3e6d8d3b4d2a5,18094007058,2,"Sugar Free, Iced Orange","Maltitol, Sorbitol, Gum Base, Maltitol Syrup, Natural and Artificial Flavors, Carnauba Wax, Caffeine, Taurine, Titanium Dioxide (Color), Gum Arabic, Citric Acid, Inositol, Niacinamide, Malic Acid, Glycerin, Sucralose, Calcium Pantothenate, Aspartame, Soy Lecithin, Resinous Glaze, Fumaric Acid, Pyridoxine Hydrochloride, Acesulfame Potassium, Riboflavin, Cyanocobalamin, BHT (to Maintain Freshness). Active Ingredients (per Serving): Caffeine (80 mg), Taurine (75 mg), Inositol (25 mg), Vitamin B3 (20 mg), Vitamin B5 (10 mg), Vitamin B6 (2 mg), Vitamin B2 (0.5 mg), Vitamin B12 (6 mcg).",10,0,0,null,null,null,null,null,0,3,null,0,0,0,0,0,0,null,null,2,pieces,null,null,null,null,2014-11-24T20:24:24+00:00,null
America's Choice,"Lima Beans, Lima Bean, Fordhook",51db37b0176fe9790a8983ea,51c3f9c797c3e6dfa4df047a,54807100951,2,"Lima Bean, Fordhook","Fordhook Lima Beans, Salt (Processing Aid).",100,0,0,0,0,null,null,0,5,18,4,3,6,2,25,0,10,null,6,0.5,cup,94,94,g,null,2014-11-24T20:24:24+00:00,null
Unknown,Coconut Oil,526831133203b9c3390001c8,54a6c78c2dea1e720d42ead5,26700155420,2,null,null,120,126,14,12,0,null,null,null,null,0,null,null,0,null,null,null,null,null,null,15,ml,null,15,ml,https://d1r9wva3zcpswd.cloudfront.net/54a6cda0d9eab4484bcdb991.jpeg,2015-01-02T16:56:00+00:00,null
Crio Bru,"Cavalla French Roast, Coffee",545b9c34546fc72656d568ed,5522a61843e613de6336b086,628586372764,2,null,null,10,null,0,null,null,null,null,null,0,1.5,null,0,null,null,null,null,null,null,null,2,tbsp grounds,null,null,g,https://d1r9wva3zcpswd.cloudfront.net/5522a629b4e7ef126780abbd.jpeg,2015-04-06T15:28:41+00:00,null
Dillions,"Potato Salad, Mustard",54dcd2202c7abad33391e400,5564d0606996de8b6d3d0533,11110653734,2,null,null,190,90,10,1.5,0,null,null,15,580,24,3,4,3,0,10,0,8,null,3.5,0.5,cup,135,135,g,https://d1r9wva3zcpswd.cloudfront.net/5564d1a00620b94f48f4181d.jpeg,2015-05-26T20:03:44+00:00,null
WinCo Foods,"Sugar, granulated",5457c38253af3d475e632a6f,54fb6d450fa179a75619f8ee,70552904040,2,null,null,15,0,0,0,0,null,null,0,0,4,0,4,0,0,0,0,0,null,454,1,tsp,4,4,g,https://d1r9wva3zcpswd.cloudfront.net/54fb6e13a1aed1f4311ba73a.jpeg,2015-03-07T21:30:59+00:00,null
Michele's,"Granola, Pumpkin Spice",51db37ce176fe9790a899c10,525ec93f9f1e7c0500000996,793573481528,2,null,null,150,90,10,2,0,null,null,0,0,13,2,5,3,0,0,2,6,null,12,0.25,cup,28,28,g,https://d1r9wva3zcpswd.cloudfront.net/536bbc9a90c62af30c28525b.jpeg,2014-11-24T20:24:24+00:00,null
Lipton Beverage,"Iced Tea Mix, Lemon Calorie Free",51db37c9176fe9790a8996ef,51c5498c97c3e6efadd5ff06,41000008771,2,Lemon Calorie Free,"Citric Acid (Provides Tartness), Instant Tea, Maltodextrin, Sodium Saccharin, Natural Lemon Flavor.",0,0,0,null,null,null,null,null,5,0,null,0,0,0,0,0,0,null,140,1.2,G,1,1,g,null,2014-11-24T20:24:24+00:00,null
The Deli Counter,Party Cheese Tray,51db37e7176fe9790a89a71a,54b82350621847b127744c31,21130046119,2,null,null,110,80,9,6,0,null,null,35,190,1,null,null,8,6,null,20,null,null,3.5,2,slices,32,32,g,https://d1r9wva3zcpswd.cloudfront.net/54b8245d621847b127744c97.jpeg,2015-01-15T20:34:37+00:00,null
CVS Pharmacy,Men's Daily Gummies,51db37ba176fe9790a898cfa,54ca6517064e3a791d67382e,50428462171,2,null,null,15,null,null,null,null,null,null,null,null,3,null,3,null,80,125,null,null,null,25,2,gummies,null,null,g,https://d1r9wva3zcpswd.cloudfront.net/54de4d0f7ea1cda21acc59e0.jpeg,2015-02-13T19:14:23+00:00,null
Spartan,Vanilla Sandwich Cremes,51db37cc176fe9790a899a4d,51c35d2e97c3e69de4b00d2e,11213900759,2,"Sandwich Cremes, Vanilla","Enriched Flour (Contains: Wheat) (Bleached Wheat Flour, Niacin, Reduced Iron, Thiamin Mononitrate [Vitamin B1], Riboflavin [Vitamin B2], Folic Acid), Sugar, Vegetable Oil (Contains: Soy) (Contains One or More of the Following: Palm, Canola, Soybean with TBHQ for Freshness), Corn Syrup, Dextrose, Corn Flour, Contains Two Percent or Less of: Cornstarch, Salt, Baking Soda, Soy Lecithin (Contains: Soy) (Emulsifier), Artificial Color (FD&C Yellow 5, Yellow 6), Natural and Artificial Flavors.",120,40,4.5,1.5,0,1.5,1.5,0,75,19,0,9,1,0,0,0,4,null,26,2,cookies,26,26,g,https://d1r9wva3zcpswd.cloudfront.net/536a758521f62f01209bd49d.jpeg,2014-11-24T20:24:24+00:00,null
French Bakery Inc.,Italian Pull-A-Part 3/4 Bake,554c4ed2ad93e45475aba77b,554c4e24a81c45e161cb47c0,42155000573,2,null,null,100,0,0,0,0,null,null,0,210,21,1,0,3,null,null,null,null,null,10,1,roll,100,100,g,https://d1r9wva3zcpswd.cloudfront.net/554c4e11ccaba88f04eef04d.jpeg,2015-05-08T05:48:01+00:00,null
Nutrisystem,Rotini & Meatballs,53d0085ffdb35bcf368daf5f,5457c450c0cdde5a6ab18cd1,632674650290,2,null,null,220,50,6,2.5,0,null,null,25,600,26,3,6,17,2,4,15,15,null,1,1,package,227,227,g,https://d1r9wva3zcpswd.cloudfront.net/5457d1bd0d5781691593f159.jpeg,2014-11-24T20:24:24+00:00,null
Tom Sturgis,"Pretzels, Specials",51db3800176fe9790a89adf1,51c3d71497c3e6d8d3b542d2,70104100012,2,Specials,"Choice Blended Wheat Flour, Salt, Vegetable Shortening (Contains One or More of the Following: Corn, Canola, Cottonseed, Sunflower, Soybean Oil), Yeast, Malt Syrup, Corn Syrup and Soda.",120,10,1,0,0,null,null,0,340,24,2,0,3,0,0,0,8,null,24,5,pretzels,28,28,g,null,2014-11-24T20:24:24+00:00,null
HCG Support Shake,"Meal Replacement, Rich Vanilla Beans",55080f5847a43f8a4a0a4d17,55080fc7f9212f824cbc9adc,753182239620,2,null,null,103,18,2,null,null,null,null,0,145,7,5,0,14,50,50,15,50,null,20,41,g,41,41,g,https://d1r9wva3zcpswd.cloudfront.net/55081081fb5995d662a90629.jpeg,2015-03-17T11:31:13+00:00,null
Edy's,"Outshine Fruit Bars, Strawberry Wildberry Lime",51db37e9176fe9790a89a7b2,554cf78d4dabd8be64c30783,4157687,2,null,null,40,0,0,0,0,null,null,0,0,10,0,10,0,0,20,0,0,null,12,1,bar,46,46,g,https://d1r9wva3zcpswd.cloudfront.net/554cf729a5b0b55b39e8275b.jpeg,2015-05-08T17:49:29+00:00,null
Best Choice,"Shredded Cheese, Fancy, Asiago Medium",51db37b1176fe9790a8984c7,51c3f3c597c3e6de73cbde44,70038597124,2,"Fancy, Asiago Medium","Cultured Pasteurized Milk, Salt, Enzymes, Potato Starch and Powdered Cellulose Added to Prevent Caking, Natamycin (a Natural Mold Inhibitor).",110,70,9,6,0,null,null,25,310,0,0,0,7,6,0,25,0,null,6,0.33,cup,28,28,g,null,2014-11-24T20:24:24+00:00,null
Cap Candy,"Spin Pop Candy, Toy Story 2, Woody",51db37c6176fe9790a899477,51c3694b97c3e69de4b067b4,22629045712,2,"Toy Story 2, Woody","Sugar, Corn Syrup. Starch, Citric Acid, Glycerin, Artificial Flavors, Artificial Colors (Including FD&C Blue No. 1), Turmeric Coloring, and BHT Added as a Preservative.",60,0,0,null,null,null,null,null,0,14,null,12,0,0,0,10,0,null,1,1,pop,null,null,null,null,2014-11-24T20:24:24+00:00,null
Juicy Fruit,"Chewing Gum, Slim Packs",51db37c9176fe9790a899695,51c368ca97c3e69de4b062f3,22000106988,2,Slim Packs,"Sugar, Gum Base, Corn Syrup, Dextrose, Less than 2% of: Natural and Artificial Flavors, Glycerol, Soy Lecithin, Aspartame, Acesulfame K, Hydroxylated Soy Lecithin, Color (Yellow 5 Lake), BHT (to Maintain Freshness).",10,0,0,null,null,null,null,null,0,2,null,2,0,0,0,0,0,null,150,1,stick,2.7,2.7,g,null,2014-11-24T20:24:24+00:00,null
Tom Sturgis,"Pretzels, Sourdough Hard",51db3800176fe9790a89adf1,51c3d71097c3e6d8d3b542ad,70104999777,2,Sourdough Hard,"Unbleached Wheat Flour, Water, Salt, Yeast, Soda.",140,0,0,0,0,null,null,0,240,18,0,0,2,0,0,0,0,null,11,1,pretzel,31,31,g,null,2014-11-24T20:24:24+00:00,null
O Organics,"Macaroni and Cheese Dinner, Organic, Three Cheese",51db37b1176fe9790a898469,51c3f93097c3e6dfa4df012e,79893406978,2,"Organic, Three Cheese","Organic Semolina Flour (Durum Wheat), Water, Organic Whole Milk (Grade A Milk, Vitamin D3), Organic White Cheddar Cheese (Pasteurized Grade A Milk, Salt, Cheese Culture, Non-Animal Rennet), Organic Pasteurized Eggs, Organic Unsalted Butter (Grade A Pasteurized Sweet Cream, Lactic Acid), Organic Mozzarella Cheese (Cultured Pasteurized Whole Milk, and Skim Milk, Salt, Microbial Enzymes), Organic Natural Corn Starch, Sea Salt, Organic Wheat Gluten, Natural Organic Cheese Flavor, Organic Parmesan Cheese (Cultured Part Skim Milk, Salt, Enzymes), Organic Black Pepper, Organic Cayenne Pepper, Organic Natural Annatto, Organic Onion Powder.",310,60,7,4,0,null,null,35,460,49,3,3,12,4,0,21,15,null,4,5,oz,142,142,g,null,2014-11-24T20:24:24+00:00,null
Pereg,"Couscous, Tomato & Herbs",51db37c6176fe9790a899414,51c400a697c3e6dfa4df37e8,13568001877,2,Tomato & Herbs,"All Natural: Couscous, Diced Tomatoes, Herbs, Spices & Onions.",130,15,2,0,0,null,null,0,10,24,2,1,5,10,8,2,4,null,3,0.33,cup,53,53,g,null,2014-11-24T20:24:24+00:00,null
Chompie's,"NY Plain Bagels, Mini",51db37c5176fe9790a8993aa,560d2b01b1050e7102471bf2,96784102511,2,null,null,110,0,0,0,0,null,null,0,210,23,1,2,4,0,0,4,8,null,12,1,bagel,43,43,g,https://d1r9wva3zcpswd.cloudfront.net/560d2d6d5ad577cc23904ac1.jpeg,2015-10-01T12:56:13+00:00,null
Smart Ones,Classic Favorites Mini Rigatoni with Vodka Cream Sauce,51db37f0176fe9790a89a99d,51c36b3a97c3e69de4b0788f,25800020249,2,null,"Cooked Enriched Macaroni Product (Water, Enriched Semolina (Semolina, Niacin, Iron, Thiamine Mononitrate, Riboflavin, Folic Acid), Whole Wheat Flour), Vodka Cream Sauce (Water, Tomatoes [Tomatoes, Tomato Juice, Calcium Chloride, Citric Acid], Tomato Puree [Tomato Paste, Water], Cream [Cream, Milk, Carrageenan], Vodka [Vodka, Salt], Onions, Romano Cheese [Cow's Milk, Cheese Cultures, Salt, Enzymes], Cheese Flavor [Water, Lipolyzed Cream, Butterfat, Salt, Flavoring], Whey Protein Concentrate, Parmesan Cheese [Part Skim Milk, Cheese Cultures, Salt, Enzymes], Olive Oil, Sugar, Modified Cornstarch, Granulated Garlic, Spices, Garlic in Oil [Garlic, Soybean Oil, Citric Acid], Salt, Xanthan Gum, Flavor [Potassium Chloride, Ammonium Chloride, Yeast Extract, Maltodextrin (Corn), Lactic Acid, Citric Acid, Calcium Lactate, Natural Flavor], Lactic Acid, Onion Concentrate [Sauteed Onions, Butter, Salt, Sugar, Onion Powder, Natural Flavor], Tomato Flavor [Medium Chain Triglycerides, Flavor, Soybean Oil], Black Pepper), Reduced Fat Mozzarella Cheese (Part Skim Milk, Cultures, Salt, Vitamin A Palmitate, Enzymes), Water, Carrageenan.",280,50,6,2.5,0,1,1.5,10,450,46,4,6,12,15,6,20,10,null,1,1,package,255,255,g,https://d1r9wva3zcpswd.cloudfront.net/53600a5a2ae36a5775c09c4e.jpeg,2014-11-24T20:24:24+00:00,null
Laura Scudder's,"Dip, Toasted Onion, with Shallots",51db37c9176fe9790a89970c,51c3615c97c3e69de4b02998,15500201208,2,"Toasted Onion, with Shallots","Sour Cream (Cultured Milk, Cream, Nonfat Milk Powder, Gelatin), Toasted Onion Flavor Mix (Toasted Onion, Salt, Sugar, Guar Gum, Caramel Color, Monosodium Glutamate, Partially Hydrogenated Soybean Oil & Cottonseed Oil, Tricalcium Phosphate), Onion, Shallot, Parsley, Sodium Benzoate, Potassium Sorbate.",60,40,4,3,null,null,null,15,150,2,0,1,1,2,0,0,0,null,11,2,tbsp,30,30,g,null,2014-11-24T20:24:24+00:00,null
Martin's,Potato Rolls,51db37c6176fe9790a899402,55677432ff548c1b685ac92b,7564444,2,null,null,130,10,1.5,0,0,0,0,0,180,24,2,5,7,0,0,20,10,null,8,1,roll,53,53,g,https://d1r9wva3zcpswd.cloudfront.net/5567736337081fb05bbe76a8.jpeg,2015-05-28T19:58:28+00:00,null
Yamamotoyama,Yaki Nori Roasted Seaweed,51db37cf176fe9790a899cdc,51c53ea697c3e6efadd5a958,11152250830,2,Toasted Seaweed,Ingredients: Seaweed,10,0,0,0,0,null,null,0,20,1,0,0,1,20,0,0,2,null,10,1,sheet,3,2.5,g,https://d1r9wva3zcpswd.cloudfront.net/54072e8c7f1cfd9d3a07a927.jpeg,2014-11-24T20:24:24+00:00,null
Hungry Jack,Redskin & Gold Mashed Potatoes,51db37b9176fe9790a898b66,542ada06bb5a9a3d2cbe2280,11140871054,2,null,null,90,0,0,0,0,null,null,0,20,19,2,0.5,2,0,15,0,2,160,15,24,g dry,24,24,g,https://d1r9wva3zcpswd.cloudfront.net/542adb5cfd57000f19b350fb.jpeg,2014-11-24T20:24:24+00:00,null
Smart Cuisine,Meatloaf & Meatball Mix,54dc45874411e9fd3e66b782,54dc45a0570111b44b848a6b,94922386908,2,null,null,330,250,28,11,null,null,null,80,60,0,null,null,18,null,null,null,6,null,5,4,oz,112,112,g,https://d1r9wva3zcpswd.cloudfront.net/54de69985f7c2fb71a703b26.jpeg,2015-02-13T21:16:08+00:00,null
Naked,"100% Juice Smoothie, Boosted Blue Machine, No Sugar Added",51db37bc176fe9790a898e18,552742831037c59e17c8ce1d,118100003279,2,null,null,110,10,1,0.5,0,null,null,40,55,2,0,1,24,0,0,15,2,null,30,1,scoop,29.93,29.93,g,https://d1r9wva3zcpswd.cloudfront.net/552742ed6b4d00b5608a82ee.jpeg,2015-04-10T03:26:37+00:00,null
Devonsheer,"Melba Rounds, Sesame 5.25 Oz",51db37ba176fe9790a898d18,51c5497997c3e6efadd5fe88,30684814839,2,Sesame 5.25 Oz,"Organic Wheat Flour, Organic Sesame Seeds, Organic Canola Oil, Sea Salt, Organic Molasses, Yeast, Organic Wheat Gluten, Organic Vinegar. Contains: Wheat.",70,15,2,0,0,null,null,0,100,11,1,0,2,0,0,0,4,null,10,15,G,15,15,g,null,2014-11-24T20:24:24+00:00,null
Colonial Kitchen,Ground Cinnamon,550204781f92d82359348256,550204c4da68c8162286a3f8,776455300209,2,null,null,0,null,0,0,null,null,null,0,0,0,null,0,0,null,null,null,null,null,142,0.25,tsp,0.6,0.6,g,https://d1r9wva3zcpswd.cloudfront.net/550204e554667443629d921e.jpeg,2015-03-12T21:28:05+00:00,null
